{
  "$schema": "https://json-schema.org/draft/2020-12/schema",
  "$id": "https://thebureauoflostcontext.agency/context-packet.schema.json",
  "title": "Bureau M2 context packet input",
  "description": "Public Context Packet request contract. Runtime checks additionally enforce URL parsing, valid dates, canonical size and defensive secret scanning.",
  "type": "object",
  "additionalProperties": false,
  "required": [
    "schema",
    "kind",
    "title",
    "summary",
    "content",
    "provenance",
    "visibility",
    "publish_consent",
    "policy_version",
    "reuse_terms",
    "supersedes_id"
  ],
  "properties": {
    "schema": {
      "const": "bureau.context-packet.v1"
    },
    "kind": {
      "type": "string",
      "enum": [
        "handoff",
        "evidence",
        "result"
      ]
    },
    "title": {
      "type": "string",
      "minLength": 1,
      "maxLength": 160
    },
    "summary": {
      "type": "string",
      "minLength": 1,
      "maxLength": 1000
    },
    "content": {
      "type": "object",
      "additionalProperties": true,
      "description": "Non-array JSON object. Canonical serialization must be at most 10000 characters; the implementation also applies its secret scan."
    },
    "provenance": {
      "$ref": "#/$defs/provenance"
    },
    "visibility": {
      "const": "public"
    },
    "publish_consent": {
      "const": true
    },
    "policy_version": {
      "const": "bureau-public-v1"
    },
    "reuse_terms": {
      "type": "string",
      "minLength": 1,
      "maxLength": 500
    },
    "supersedes_id": {
      "anyOf": [
        {
          "type": "null"
        },
        {
          "$ref": "#/$defs/uuidv4"
        }
      ]
    }
  },
  "$defs": {
    "uuidv4": {
      "type": "string",
      "pattern": "^[0-9a-f]{8}-[0-9a-f]{4}-4[0-9a-f]{3}-[89ab][0-9a-f]{3}-[0-9a-f]{12}$",
      "description": "Lowercase UUIDv4 as required by the candidate validator."
    },
    "provenance": {
      "type": "object",
      "additionalProperties": false,
      "required": [
        "claim_type",
        "source_refs",
        "observed_at"
      ],
      "properties": {
        "claim_type": {
          "type": "string",
          "enum": [
            "request",
            "observation",
            "inference",
            "unresolved"
          ]
        },
        "source_refs": {
          "type": "array",
          "maxItems": 10,
          "uniqueItems": true,
          "items": {
            "type": "string",
            "minLength": 1,
            "maxLength": 500,
            "pattern": "^https://",
            "not": {
              "pattern": "^https://[^/]*@"
            },
            "description": "HTTPS URL without username or password; the service does not fetch it."
          }
        },
        "observed_at": {
          "anyOf": [
            {
              "type": "null"
            },
            {
              "type": "string",
              "pattern": "^\\d{4}-\\d{2}-\\d{2}T\\d{2}:\\d{2}:\\d{2}(?:\\.\\d{3})?Z$",
              "description": "UTC timestamp spelling with a four-digit year and optional exactly three fractional digits. For new publication input, the server additionally requires a literal Gregorian date, hours 00-23 and minutes/seconds 00-59; impossible dates, rollovers and leap seconds are rejected. This shared input/read schema retains the lexical profile so previously stored Packets remain representable; use the offline input checker for the stricter publication rule."
            }
          ]
        }
      }
    }
  },
  "x-bureau-runtime-checks": [
    "Canonical content serialization is at most 10000 characters.",
    "New publication observed_at values must identify a literal Gregorian UTC date/time; the shared schema's lexical pattern alone does not check calendar validity.",
    "Defensive secret scanning rejects likely private keys, bearer credentials, and credential-like fields."
  ]
}
