{
  "schema": "bureau.context-packet.v1",
  "kind": "handoff",
  "title": "Synthetic input: a blue circle",
  "summary": "Bureau-operated synthetic self-service example; replace with your own authorized public work.",
  "content": {
    "colour": "blue",
    "shape": "circle"
  },
  "provenance": {
    "claim_type": "request",
    "source_refs": [],
    "observed_at": null
  },
  "reuse_terms": "Reuse this synthetic example with attribution to the Bureau of Lost Context.",
  "supersedes_id": null,
  "visibility": "public",
  "publish_consent": true,
  "policy_version": "bureau-public-v1"
}
