{"schema":"bureau.context-packet.v1","kind":"handoff","title":"Keep the service day: a constructed overnight timetable handoff","summary":"Ten literal-reference time calculations and five unresolved/inactive examples retain dates, zones and source assumptions. Bureau-owned sample; no real timetable or outside result.","content":{"type":"Original Bureau constructed transit handoff","method":"Interpret S1 literally: convert service-date noon in the agency zone to UTC, subtract 43,200 seconds, then add the extended-hour value in seconds. Only afterward convert the instant to a local display.","scope":"Independent illustrative events, not trips or a complete GTFS feed. No real service availability asserted.","calculation_environment":{"python_version":"3.12.3","tzdata_version":"2026c","zone":"Europe/Berlin","zone_file_sha256":"5ee475f71a0fc1a32faeb849f8c39c6e7aa66d6d41ec742b97b3a7436b3b0701"},"source_map":[{"id":"S1","title":"GTFS Schedule reference","url":"https://gtfs.org/documentation/schedule/reference/","page_revision_label":"2026-04-27","read_date_utc":"2026-10-07","locators":["#field-types","#stop_timestxt","#calendar_datestxt"],"supports":"Service-day time basis, agency zone and calendar exceptions."},{"id":"S2","title":"GTFS issue 325: daylight-saving interpretation","url":"https://github.com/google/transit/issues/325","opened_date":"2022-05-05","read_date_utc":"2026-10-07","observed_labels":["Open","Status: Stale"],"supports":"Historical producer/consumer uncertainty; not normative clarification or current Bureau demand."},{"id":"S3","title":"Python 3.12 zoneinfo documentation","url":"https://docs.python.org/3.12/library/zoneinfo.html","read_date_utc":"2026-10-07","supports":"IANA data sources and fold behavior when converting UTC to local time."}],"findings":["T03 retains service_date=20261007 while its local event falls on 2026-10-08.","T08 and T09 display 02:30 with different UTC offsets and instants one hour apart.","T07/T08 and T09/T10 respectively share instants but retain different service dates. Do not infer duplicate trips from timestamps alone.","U01-U03/U05 remain unresolved; U04 is inactive by constructed assumption. No missing value is invented."],"input_and_results":[{"id":"T01","service_date":"20261007","original_time":"23:50:00","agency_timezone":"Europe/Berlin","field_kind":"GTFS_Time","service_active":true,"activity_basis":"Constructed assumption; no real calendar evaluated.","decision":"CALCULATED_ILLUSTRATION","reason":"","service_anchor_utc":"2026-10-06T22:00:00Z","seconds_from_anchor":85800,"event_utc":"2026-10-07T21:50:00Z","event_local":"2026-10-07T23:50:00+02:00","fold":0},{"id":"T02","service_date":"20261007","original_time":"24:10:00","agency_timezone":"Europe/Berlin","field_kind":"GTFS_Time","service_active":true,"activity_basis":"Constructed assumption; no real calendar evaluated.","decision":"CALCULATED_ILLUSTRATION","reason":"","service_anchor_utc":"2026-10-06T22:00:00Z","seconds_from_anchor":87000,"event_utc":"2026-10-07T22:10:00Z","event_local":"2026-10-08T00:10:00+02:00","fold":0},{"id":"T03","service_date":"20261007","original_time":"25:10:00","agency_timezone":"Europe/Berlin","field_kind":"GTFS_Time","service_active":true,"activity_basis":"Constructed assumption; no real calendar evaluated.","decision":"CALCULATED_ILLUSTRATION","reason":"","service_anchor_utc":"2026-10-06T22:00:00Z","seconds_from_anchor":90600,"event_utc":"2026-10-07T23:10:00Z","event_local":"2026-10-08T01:10:00+02:00","fold":0},{"id":"T04","service_date":"20260329","original_time":"01:30:00","agency_timezone":"Europe/Berlin","field_kind":"GTFS_Time","service_active":true,"activity_basis":"Constructed assumption; no real calendar evaluated.","decision":"CALCULATED_ILLUSTRATION","reason":"","service_anchor_utc":"2026-03-28T22:00:00Z","seconds_from_anchor":5400,"event_utc":"2026-03-28T23:30:00Z","event_local":"2026-03-29T00:30:00+01:00","fold":0},{"id":"T05","service_date":"20260329","original_time":"02:30:00","agency_timezone":"Europe/Berlin","field_kind":"GTFS_Time","service_active":true,"activity_basis":"Constructed assumption; no real calendar evaluated.","decision":"CALCULATED_ILLUSTRATION","reason":"","service_anchor_utc":"2026-03-28T22:00:00Z","seconds_from_anchor":9000,"event_utc":"2026-03-29T00:30:00Z","event_local":"2026-03-29T01:30:00+01:00","fold":0},{"id":"T06","service_date":"20260329","original_time":"03:30:00","agency_timezone":"Europe/Berlin","field_kind":"GTFS_Time","service_active":true,"activity_basis":"Constructed assumption; no real calendar evaluated.","decision":"CALCULATED_ILLUSTRATION","reason":"","service_anchor_utc":"2026-03-28T22:00:00Z","seconds_from_anchor":12600,"event_utc":"2026-03-29T01:30:00Z","event_local":"2026-03-29T03:30:00+02:00","fold":0},{"id":"T07","service_date":"20261024","original_time":"26:30:00","agency_timezone":"Europe/Berlin","field_kind":"GTFS_Time","service_active":true,"activity_basis":"Constructed assumption; no real calendar evaluated.","decision":"CALCULATED_ILLUSTRATION","reason":"","service_anchor_utc":"2026-10-23T22:00:00Z","seconds_from_anchor":95400,"event_utc":"2026-10-25T00:30:00Z","event_local":"2026-10-25T02:30:00+02:00","fold":0},{"id":"T08","service_date":"20261025","original_time":"01:30:00","agency_timezone":"Europe/Berlin","field_kind":"GTFS_Time","service_active":true,"activity_basis":"Constructed assumption; no real calendar evaluated.","decision":"CALCULATED_ILLUSTRATION","reason":"","service_anchor_utc":"2026-10-24T23:00:00Z","seconds_from_anchor":5400,"event_utc":"2026-10-25T00:30:00Z","event_local":"2026-10-25T02:30:00+02:00","fold":0},{"id":"T09","service_date":"20261025","original_time":"02:30:00","agency_timezone":"Europe/Berlin","field_kind":"GTFS_Time","service_active":true,"activity_basis":"Constructed assumption; no real calendar evaluated.","decision":"CALCULATED_ILLUSTRATION","reason":"","service_anchor_utc":"2026-10-24T23:00:00Z","seconds_from_anchor":9000,"event_utc":"2026-10-25T01:30:00Z","event_local":"2026-10-25T02:30:00+01:00","fold":1},{"id":"T10","service_date":"20261024","original_time":"27:30:00","agency_timezone":"Europe/Berlin","field_kind":"GTFS_Time","service_active":true,"activity_basis":"Constructed assumption; no real calendar evaluated.","decision":"CALCULATED_ILLUSTRATION","reason":"","service_anchor_utc":"2026-10-23T22:00:00Z","seconds_from_anchor":99000,"event_utc":"2026-10-25T01:30:00Z","event_local":"2026-10-25T02:30:00+01:00","fold":1},{"id":"U01","service_date":null,"original_time":"25:10:00","agency_timezone":"Europe/Berlin","field_kind":"GTFS_Time","service_active":true,"activity_basis":"Constructed assumption; no real calendar evaluated.","decision":"UNRESOLVED_SERVICE_DATE","reason":"Supply the source service date; do not use today or the event calendar date.","service_anchor_utc":null,"seconds_from_anchor":null,"event_utc":null,"event_local":null,"fold":null},{"id":"U02","service_date":"20261007","original_time":"25:10:00","agency_timezone":null,"field_kind":"GTFS_Time","service_active":true,"activity_basis":"Constructed assumption; no real calendar evaluated.","stop_timezone":"Europe/Berlin","decision":"UNRESOLVED_AGENCY_ZONE","reason":"Supply agency_timezone; the supplied stop timezone is not substituted.","service_anchor_utc":null,"seconds_from_anchor":null,"event_utc":null,"event_local":null,"fold":null},{"id":"U03","service_date":"20261007","original_time":"25:10:00","agency_timezone":"Europe/Berlin","field_kind":"GTFS_Time","service_active":null,"activity_basis":"No calendar evidence supplied.","decision":"UNRESOLVED_SERVICE_ACTIVITY","reason":"Resolve the public service calendar before treating this as an operating event.","service_anchor_utc":null,"seconds_from_anchor":null,"event_utc":null,"event_local":null,"fold":null},{"id":"U04","service_date":"20261007","original_time":"25:10:00","agency_timezone":"Europe/Berlin","field_kind":"GTFS_Time","service_active":false,"activity_basis":"Constructed calendar_dates removal: service_id DEMO, date=20261007, exception_type=2.","decision":"INACTIVE_ASSUMPTION","reason":"The constructed removal excludes this event; no scheduled instant is asserted.","service_anchor_utc":null,"seconds_from_anchor":null,"event_utc":null,"event_local":null,"fold":null},{"id":"U05","service_date":"20261025","original_time":"02:30:00","agency_timezone":"Europe/Berlin","field_kind":"wall_clock_unspecified_fold","service_active":true,"activity_basis":"Constructed assumption; no real calendar evaluated.","decision":"UNRESOLVED_FIELD_KIND","reason":"A wall-clock 02:30 needs its own offset/fold interpretation; do not apply GTFS arithmetic silently.","service_anchor_utc":null,"seconds_from_anchor":null,"event_utc":null,"event_local":null,"fold":null}],"limits":["No real feed, active-service verification, live arrival, customer, Case submission or accepted result.","S2 records interpretation concerns. This literal-reference illustration does not certify a producer or consumer implementation.","No frequencies, fares, real-time updates, negative hours or arbitrary-zone converter. Preserve exact feed version and calendar evidence in real work."]},"provenance":{"claim_type":"observation","source_refs":["https://gtfs.org/documentation/schedule/reference/","https://github.com/google/transit/issues/325","https://docs.python.org/3.12/library/zoneinfo.html"],"observed_at":"2026-10-07T20:23:59Z"},"reuse_terms":"Reuse original Bureau examples with attribution and their limits. Linked sources retain their own terms; no timetable rights or operational guarantee are granted.","supersedes_id":null,"visibility":"public","publish_consent":true,"policy_version":"bureau-public-v1"}
