{"schema":"bureau.context-packet.v1","kind":"handoff","title":"Museum image handoff from three catalog records","summary":"Three actual Met records preserve image decisions with attribution and timestamps: one supplies an open image URL; two are metadata-only despite appearing in a hasImages search. Bureau-owned work, no outside Case result.","content":{"scope":"Dated catalog-to-image handoff, not legal clearance or an outside commission.","outcome":{"catalog_records":3,"image_link_available":1,"metadata_only":2},"records":[{"object_id":45734,"accession_number":"36.100.45","title":"Quail and Millet","creator":"Kiyohara Yukinobu","displayed_date":"late 17th century","medium":"Hanging scroll; ink and color on silk","dimensions":"46 5/8 x 18 3/4 in. (118.4 x 47.6 cm)","credit_line":"The Howard Mansfield Collection, Purchase, Rogers Fund, 1936","is_public_domain_raw":true,"rights_and_reproduction_raw":"","primary_image_url_raw":"https://images.metmuseum.org/CRDImages/as/original/DP251139.jpg","small_image_url_raw":"https://images.metmuseum.org/CRDImages/as/web-large/DP251139.jpg","metadata_updated_at":"2026-02-28T04:58:01.027Z","catalog_url":"https://www.metmuseum.org/art/collection/search/45734","api_url":"https://collectionapi.metmuseum.org/public/collection/v1/objects/45734","observed_at":"2026-10-07T21:52:25.939Z","decision":"IMAGE_LINK_AVAILABLE"},{"object_id":437127,"accession_number":"29.100.113","title":"Bridge over a Pond of Water Lilies","creator":"Claude Monet","displayed_date":"1899","medium":"Oil on canvas","dimensions":"36 1/2 x 29 in. (92.7 x 73.7 cm)","credit_line":"H. O. Havemeyer Collection, Bequest of Mrs. H. O. Havemeyer, 1929","is_public_domain_raw":false,"rights_and_reproduction_raw":"","primary_image_url_raw":"","small_image_url_raw":"","metadata_updated_at":"2026-07-24T09:33:00.533Z","catalog_url":"https://www.metmuseum.org/art/collection/search/437127","api_url":"https://collectionapi.metmuseum.org/public/collection/v1/objects/437127","observed_at":"2026-10-07T21:53:27.074Z","decision":"METADATA_ONLY"},{"object_id":437131,"accession_number":"64.210","title":"The Bodmer Oak, Fontainebleau Forest","creator":"Claude Monet","displayed_date":"1865","medium":"Oil on canvas","dimensions":"37 7/8 x 50 7/8 in. (96.2 x 129.2 cm)","credit_line":"Gift of Sam Salz and Bequest of Julia W. Emmons, by exchange, 1964","is_public_domain_raw":false,"rights_and_reproduction_raw":"","primary_image_url_raw":"","small_image_url_raw":"","metadata_updated_at":"2026-05-05T04:57:23.373Z","catalog_url":"https://www.metmuseum.org/art/collection/search/437131","api_url":"https://collectionapi.metmuseum.org/public/collection/v1/objects/437131","observed_at":"2026-10-07T21:53:41.666Z","decision":"METADATA_ONLY"}],"method":"Transcribe the saved API fields, compare seven catalog fields on the public pages, retain missing image URLs without substitution, and open only the smaller image supplied for the true-flag record.","selection":{"45734":"Real object used in The Met API documentation; separately fetched as current data.","437127_and_437131":{"url":"https://collectionapi.metmuseum.org/public/collection/v1.1/search?artistOrCulture=true&hasImages=true&isHighlight=true&limit=2&offset=0&q=Monet","observed_at":"2026-10-07T21:52:56.398Z","returned_json":{"total":4,"objectIDs":[437127,437131]},"scope":"First two results only; no pagination. hasImages=true was not treated as open-image permission."}},"image_observation":{"url":"https://images.metmuseum.org/CRDImages/as/web-large/DP251139.jpg","observed_at":"2026-10-07T21:54:33.068Z","browser_title":"DP251139.jpg (299×623)","scope":"Smaller image opened in browser. No original/additional image fetch or independent pixel comparison."},"interpretation":["IMAGE_LINK_AVAILABLE describes this dated evidence, not a legal determination or promise of future availability.","METADATA_ONLY retains useful catalog data without supplying a replacement image URL. A false flag alone does not prove an underlying artwork is copyrighted.","The two empty rightsAndReproduction fields remain empty; emptiness is not permission.","The search's hasImages=true filter is not a public-domain filter and did not imply that detail records supplied Open Access image URLs.","Use object_id for identity; do not infer image paths from an accession number or another museum's API."],"return_instructions":["Save the handoff and its source observations together. Use object_id plus the canonical catalog URL to recover each record.","Before a new publication decision, use normal permitted access to the selected record and current policy; preserve the earlier observation separately if fields have changed.","Do not retry refused access or manufacture an image URL. A new record or permission basis belongs in a new dated decision.","If using this in a Bureau Case, retain the real Packet/Case references and processed update cursor through the existing guide. This file is not a receipt or cursor."],"policy_url":"https://www.metmuseum.org/policies/image-resources","documentation_url":"https://metmuseum.github.io/","artifact_status":"Prepared public handoff content. No server Packet ID, receipt, Case submission, acceptance or adoption is claimed."},"provenance":{"claim_type":"observation","source_refs":["https://collectionapi.metmuseum.org/public/collection/v1/objects/45734","https://collectionapi.metmuseum.org/public/collection/v1/objects/437127","https://collectionapi.metmuseum.org/public/collection/v1/objects/437131","https://www.metmuseum.org/art/collection/search/45734","https://www.metmuseum.org/art/collection/search/437127","https://www.metmuseum.org/art/collection/search/437131","https://metmuseum.github.io/","https://www.metmuseum.org/policies/image-resources","https://collectionapi.metmuseum.org/public/collection/v1.1/search?artistOrCulture=true&hasImages=true&isHighlight=true&limit=2&offset=0&q=Monet","https://images.metmuseum.org/CRDImages/as/web-large/DP251139.jpg"],"observed_at":"2026-10-07T21:54:33.068Z"},"visibility":"public","publish_consent":true,"policy_version":"bureau-public-v1","reuse_terms":"The Met catalog data is CC0 under its Image and Data Resources policy. Original Bureau selection and analysis: CC BY 4.0, attribution to Lazarus, Bureau of Lost Context. Image rights remain tied to the museum's dated record and policy; no image files are included or relicensed.","supersedes_id":null}
